news_headline,news_article,news_category
Govt may lower import duty on EVs if Tesla manufactures cars in India: Report,"The government is open to consider reducing import duty and offer incentives for Tesla if it decides to manufacture its cars in India, ET reported citing a government official. Last week, CEO Elon Musk said Tesla wants to launch electric vehicles (EVs) in India, but ""import duties are the highest in the world by far of any large country"".",automobile
Tesla surpasses $1 billion quarterly profit for 1st time despite chip shortage,"Billionaire Elon Musk-led Tesla on Monday reported more than $1 billion in quarterly profit for the first time despite a global semiconductor shortage. The electric car maker's second quarter profit came in at $1.14 billion, 10 times higher than its profit of $104 million in the year-ago period. Its revenue nearly doubled to $11.96 billion in the quarter.",automobile
Tesla Model 3 car drives through deep floodwater in China; video viral,"A video showing a Tesla Model 3 wading through deep floodwater in China has gone viral. Recorded in Henan province, which received the highest rainfall in over 1,000 years, the video garnered 13 lakh views on Twitter. In a 2016 tweet, Elon Musk said, ""Model S floats well enough to turn it into a boat for short periods of time.""",automobile
Testing self-driving cars in New York City is a headache: Mobileye,"Intel's Mobileye CEO Amnon Shashua has said testing self-driving vehicles in New York City is ""really a huge headache"". He said the firm has begun testing camera-only vehicles in the city in the past weeks. He listed a range of driving challenges, including light pollution at night, aggressive driving and pedestrians ignoring traffic rules.",automobile
Amazon-backed EV startup Rivian raises $2.5 billion,"US-based electric vehicle startup Rivian has raised $2.5 billion in a funding round led by existing investors Amazon, Ford Motor, D1 Capital Partners and T Rowe Price. Rivian will seek a valuation of well over $50 billion in a potential IPO later this year, Reuters reported. The startup closed a $2.65 billion investment round in January.",automobile
Electric cars 19% to 34% cleaner than petrol cars in India: Study,"Lifetime emissions for battery electric vehicles in India are 19%-34% lower compared to that of gasoline cars, a study by the International Council on Clean Transportation found. The life-cycle benefits of EVs are present even in China and India that rely heavily on coal power, it said. Combustion engine cars need to be phased out globally, researcher Georg Bieker said.",automobile
"BMW says production of 10,000 cars affected due to chip shortage","BMW said on Tuesday that nearly all of its German plants have been affected by the ongoing shortage of semiconductors. This is further preventing BMW from completing the production of around 10,000 cars, the company said. Earlier this month, BMW had said that the chip supply shortage has led to almost 30,000 vehicles in lost production so far this year.",automobile
US tests magnetised cement that can charge EVs as they drive,"Indiana's Department of Transport is testing a new type of cement with embedded magnetised particles that can wirelessly charge electric vehicles as they drive. The cement will be tested in a lab in first two phases and then a quarter-mile-long road for testing will be constructed. After finishing the tests, a segment of interstate highway within Indiana will be electrified.",automobile
"Aus deploys cameras to detect drivers on phones, without seatbelts","Australian authorities have deployed smart cameras in Queensland that are capable of detecting the possible use of mobile phones while driving and missing seatbelts. The cameras take multiple pictures of vehicles and upon detecting a possible offence, the image is flagged. It's illegal to hold a phone in hand or have it resting on one's lap while driving in Australia.",automobile
Tesla will open its charging network to other EVs this year: Musk,"Tesla is planning to open its network of Superchargers to other electric vehicles (EVs) later this year, CEO Elon Musk said on Twitter. He later added that the charging network will be opened to other EVs in all countries over time. Tesla claims to have the largest fast charging network in the world with more than 25,000 Superchargers.",automobile
Tesla seeks reduction in import duty on EVs in India: Report,"Tesla has written to Indian ministries, including the transport and heavy industries ministries, seeking a reduction in import duty on electric vehicles, Reuters reported. It has said that reducing federal taxes on imports of fully assembled electric cars to 40% would be more appropriate. Tesla believes at 40% import duty, electric cars can become more affordable.",automobile
Porsche must pay $47 mn for breach of tax filings duty: German prosecutors,"Porsche must pay a fine of $47 million (€40 million) for breach of duty relating to its tax filings, German prosecutors said on Wednesday. The German carmaker was paying that sum to the state of Baden-Wurttemberg and not taking any legal action against the fine, the prosecutors added. ""Therefore the proceedings against Porsche have been legally completed,"" they said.",automobile
Global chip shortage will dent car sales in 2021's 2nd half: Daimler,Mercedes-Benz maker Daimler has said that the global shortage of semiconductor chips will dent car sales in the second half of 2021 and will extend into 2022. Daimler's CEO Ola Kallenius said that improving supply visibility is a top priority and the chip shortage is a fixable problem. Daimler had cut back production this year due to chip shortage.,automobile
"Tata Motors' Q1 net loss narrows to ₹4,450 cr, revenue at ₹66,406 cr","Tata Motors has narrowed its consolidated net loss to ₹4,450.12 crore in the April-June quarter from ₹8,443.98 crore in the year-ago period. The firm's consolidated revenue from operations during the period stood at ₹66,406.05 crore as against ₹31,983.06 crore in the year-ago period. Jaguar Land Rover reported a 68.1% year-on-year increase in retail sales at 1,24,537 units in Q1.",automobile
Tata Motors planning to hike passenger vehicle prices: Official,"Tata Motors is looking to increase prices of its entire range of passenger vehicles from next week, its Passenger Vehicles Business Unit President Shailesh Chandra said. ""We've seen a very steep increase in...prices of steel and precious metals over the last...year,"" he said. Only a small part of the increase in input costs was passed on to customers, he added.",automobile
GM sues Ford over use of 'BlueCruise' name for hands-free driving tech,"General Motors and its subsidiary Cruise have filed a lawsuit in the US to stop Ford Motor from using the name ""BlueCruise"" to market its hands-free driving technology. GM said Ford's use of the BlueCruise name infringed on GM's Super Cruise trademark, as well as Cruise's trademark. Ford called the lawsuit ""meritless and frivolous"".",automobile
Alphabet's Waymo asks UK govt not to limit autonomous cars on road,"Waymo, a self-driving car startup owned by Google's parent Alphabet, has asked the UK government not to impose limits on the number of autonomous cars allowed on the road. It also called for an expert regulator to oversee the operation of autonomous vehicles in UK. The UK Law Commission has sought consultation on how to regulate self-driving vehicles in future.",automobile
